{
  "$schema": "https://json-schema.org/draft/2020-12/schema",
  "$id": "https://example.org/deutschland-white-gold/metrics_7d.schema.json",
  "title": "metrics_7d",
  "type": "object",
  "required": ["schema_version"],
  "properties": {
    "schema_version": { "type": "string", "const": "0.2.0" },
    "articles_per_day": {
      "type": "object",
      "additionalProperties": { "type": "integer", "minimum": 0 }
    },
    "tag_counts": {
      "type": "object",
      "additionalProperties": { "type": "integer", "minimum": 0 }
    },
    "by_source_category": {
      "type": "object",
      "additionalProperties": { "type": "integer", "minimum": 0 }
    }
  },
  "additionalProperties": true
}
