{
  "schema_version": "0.2.0",
  "articles_per_day": {
    "2025-11-03": 1,
    "2025-11-13": 1,
    "2025-11-14": 1,
    "2025-11-18": 2
  },
  "tag_counts": {
    "exploration": 2,
    "politik": 3,
    "industrie": 2,
    "umwelt": 3
  },
  "by_source_category": {
    "broadcast": 3,
    "national": 2
  }
}
